{
  "canonical_future_wrapper": "scripts/check_semantic_quarantine_history_successor.sh",
  "descendant_policy": "ARBITRARY_DESCENDANTS_AND_STAGED_CHANGES_ALLOWED_NOT_ATTESTED",
  "no_second_state_lifecycle": true,
  "plants": [
    "WRONG_TRANSACTION_PARENT",
    "WRONG_TRANSACTION_TREE",
    "WRONG_TRANSACTION_SCOPE",
    "WRONG_TRANSACTION_ARTIFACT",
    "WRONG_ANCESTRY_ORDER",
    "TOPOLOGY_NOT_ANCESTOR",
    "UNRELATED_PRECOMMIT_STAGED_PATH",
    "DUPLICATE_JSON_KEY",
    "NONCANONICAL_JSON_BYTES",
    "CANONICAL_FIRST_PARENT_MERGE"
  ],
  "precommit_foreign_snapshot": [
    {
      "byte_size": 2567,
      "kind": "file",
      "mode": 384,
      "path": "README.md",
      "sha256": "583c285aa9cf3f6f38d56e807c29102d093aed3868f9b8087267c59d5cc323c3"
    },
    {
      "byte_size": 1385,
      "kind": "file",
      "mode": 384,
      "path": "docs/generated/PROJECT_STATUS.md",
      "sha256": "d2ef3e4d64373dbb58177f32d1fbae501cdfacb4315946e3767b2609837c07f7"
    },
    {
      "byte_size": 1083,
      "kind": "file",
      "mode": 384,
      "path": "docs/generated/PUBLIC_ROUTE_GRAPH.md",
      "sha256": "05666cf539b9161c4675c7e1c65467d422459049fdd635b6dc2b08d85581c4e1"
    },
    {
      "byte_size": 1068,
      "kind": "file",
      "mode": 384,
      "path": "docs/generated/WORK_QUEUE.md",
      "sha256": "4a167b027a6ca482f55ebc1b2f4928e9ff834112f86c2097f26f084a6a6fcb54"
    },
    {
      "byte_size": 9746,
      "kind": "file",
      "mode": 436,
      "path": "docs/routeB_bus/mythos/DRAFT_ARSENAL_CARD_CANDIDATES_BB_GORZ_20260827.md",
      "sha256": "1eaf577e05e55e63433e5711bf1bdd761a6d60673413467465bae66e60233de1"
    },
    {
      "byte_size": 7192,
      "kind": "file",
      "mode": 436,
      "path": "docs/routeB_bus/mythos/DRAFT_CODEX_TASK_CONTROL_PLANE_REFRESH_20260827.md",
      "sha256": "a09d4ab25673f3ead8900d676acf09a5d3c876eb06e7806a2856e7ee5298e0f8"
    },
    {
      "byte_size": 5906,
      "kind": "file",
      "mode": 436,
      "path": "docs/routeB_bus/mythos/DRAFT_CODEX_TASK_RH_PROVEN_RENAME_20260827.md",
      "sha256": "2b5eda8346e452af949ec9683346ecdc1c61674d83515d0c4ab3021616a70e8a"
    },
    {
      "byte_size": 7526,
      "kind": "file",
      "mode": 436,
      "path": "docs/routeB_bus/mythos/DRAFT_EXTERNAL_INTERFACE_FAITHFULNESS_AUDIT_BRIEF_v1_20260827.md",
      "sha256": "f694e90b7964139e41e395d7cc501b8d40ae1a5ecb0207efafe94f748b3399a6"
    },
    {
      "byte_size": 6392,
      "kind": "file",
      "mode": 436,
      "path": "docs/routeB_bus/mythos/DRAFT_ROUTE_B_CONTRACT_V2_STATUS_ADDENDUM_v1_20260827.md",
      "sha256": "7074c2a6423ce482444166cf004458ebc6f5bf018bd0cf6f2ada946b1489ab06"
    },
    {
      "byte_size": 6150,
      "kind": "file",
      "mode": 436,
      "path": "docs/routeB_bus/mythos/MYTHOS_PREDICTION_REGISTER_20260827.md",
      "sha256": "ada1dd5328fcac12d85413ec4313e5d314862ea2a11edff5cf0e761d62f8961c"
    },
    {
      "byte_size": 5108,
      "kind": "file",
      "mode": 436,
      "path": "docs/session_protocols/SESSION_PROTOKOLL_2026-08-28.md",
      "sha256": "3a538cf89f0cd9587baec5f8749bd4293f88244cd51b7661e11b8d1f08624a62"
    },
    {
      "byte_size": 0,
      "kind": "file",
      "mode": 436,
      "path": "orchestrator/state/*.db",
      "sha256": "e3b0c44298fc1c149afbf4c8996fb92427ae41e4649b934ca495991b7852b855"
    },
    {
      "byte_size": 710,
      "kind": "file",
      "mode": 436,
      "path": "orchestrator/state/PROJECT_FACTS.json",
      "sha256": "5cdadb59f4bc1ce5fbcdb1229e18d82e2bd2562c3cfaa9fa637d0102436809e8"
    },
    {
      "byte_size": 3129,
      "kind": "file",
      "mode": 384,
      "path": "orchestrator/state/PROJECT_STATE.json",
      "sha256": "2e1273f2e383a54f6f9c9b82a57dcb8b64e3b229913f16263ab35273001250a4"
    },
    {
      "byte_size": 816,
      "kind": "file",
      "mode": 436,
      "path": "orchestrator/state/PROJECT_STATE_EVENTS.jsonl",
      "sha256": "ded252796f8ac44bc2abaaeec48f3277b563f2395f7e6bdd338f603d462fbb07"
    },
    {
      "byte_size": 6812,
      "kind": "file",
      "mode": 384,
      "path": "q3.lean.aristotle/PROJECT_ORCHESTRATOR.md",
      "sha256": "c9a0d1c1059e49426ebf03ca0260f0ba09086b9f4e080b2ac0a1085af7215ba8"
    }
  ],
  "precommit_foreign_snapshot_sha256": "8562a814226c48f11f0107d6ccca8964fe804edc29af663080f8761deab0d7a7",
  "prospective_tree_excluding_receipt": "5833df07981744dad40ad7aaac94a26491124a5a",
  "schema_version": "q3.semantic_quarantine_history_successor.v1",
  "status": "P9_P10_HISTORY_BOUND_DESCENDANTS_ALLOWED",
  "successor_objects": {
    "docs/semantic_quarantine/SEMANTIC_QUARANTINE_HISTORY_SUCCESSOR_SCHEMA_v1.json": {
      "byte_size": 4454,
      "mode": "100644",
      "oid": "3ce22b8e990fff69acae4fbfedc2c66595ef1f60",
      "sha256": "f4201aad591c732995f2f6aaa4c4d1c52a91eafefa8c1a44684a500097ae1c44"
    },
    "orchestrator/semantic_quarantine_history_successor.py": {
      "byte_size": 18299,
      "mode": "100644",
      "oid": "c70618c4eb27f49fc48c0a2c3aa8714e8d735020",
      "sha256": "db8b7b208b9d5cc76f39bf3baf2b2fb3ffd4f51803f3af269f10ddda7d04c987"
    },
    "orchestrator/tests/test_semantic_quarantine_history_successor.py": {
      "byte_size": 5603,
      "mode": "100644",
      "oid": "5f5bd8ffac8f3915d4ed536a7aa63c06ee1cdd0c",
      "sha256": "4ebf76070bdc6b6e1248432cefa117a8cce53d0366940125f587c92c1f35dc8d"
    },
    "scripts/check_semantic_quarantine_history_successor.sh": {
      "byte_size": 405,
      "mode": "100755",
      "oid": "d7e463a065dcbdcf43181c7c60af2c5a0371e72f",
      "sha256": "a8f3b85f2bfb920c4b868b537c8ad454b5223391dd8d3691249cec40cb089677"
    }
  },
  "successor_paths": [
    "docs/semantic_quarantine/SEMANTIC_QUARANTINE_HISTORY_SUCCESSOR_RECEIPT_v1.json",
    "docs/semantic_quarantine/SEMANTIC_QUARANTINE_HISTORY_SUCCESSOR_SCHEMA_v1.json",
    "orchestrator/semantic_quarantine_history_successor.py",
    "orchestrator/tests/test_semantic_quarantine_history_successor.py",
    "scripts/check_semantic_quarantine_history_successor.sh"
  ],
  "superseded_transaction_state_wrappers": [
    "scripts/check_root_archive_preflight.sh",
    "scripts/check_root_archive_lifecycle_successor.sh",
    "scripts/check_repository_topology_decision.sh"
  ],
  "topology_commit": "72377c2a12b17a3590b5f460b039e9cbe4d6d9b7",
  "transaction_chain_digest": "49b550051fffaf7b494ddc6adf84e18934d0fa92cea84ec719df3b904db32bc0",
  "transactions": [
    {
      "artifacts": {
        ".codex_browser_snapshot_proshka.md": {
          "kind": "absent"
        },
        "archive/root_artifacts/browser_snapshots/.codex_browser_snapshot_proshka.md": {
          "byte_size": 139143,
          "kind": "blob",
          "mode": "100644",
          "oid": "2d724297c71e344f09968eb09b66c2b4e6828220",
          "sha256": "34117cfc30c2ea1c0c03b7fb4bc1f3c61d06c7203693cb63bd2b3bec6f615c82"
        },
        "archive/root_artifacts/browser_snapshots/louise-current-tab.png": {
          "byte_size": 115045,
          "kind": "blob",
          "mode": "100644",
          "oid": "5851bebb44c9d9ec14a6b61204155a742cd8b2c1",
          "sha256": "818b7245efef9ab1e896a3c0a1fd6ec37d44e1dfc98acf751f7655ec51e6a2fb"
        },
        "archive/root_artifacts/browser_snapshots/louise-last-response.md": {
          "byte_size": 14451,
          "kind": "blob",
          "mode": "100644",
          "oid": "33d03acfba6811861f99254a90a34b4ea872d31c",
          "sha256": "5d1aeeba935564f7aa2c68a70f9e8e3abce92feacf60ec2f1772e786af030110"
        },
        "archive/root_artifacts/provenance/codex_4af2_uncommitted_20260727.patch": {
          "byte_size": 21750,
          "kind": "blob",
          "mode": "100644",
          "oid": "3181f913c0dd04e2ccb6263429191edb68eae2d6",
          "sha256": "625967f99367bd4471a00cc4e0db70a81e9071a358bc752a42fe4c7ee0f7e7af"
        },
        "archive/root_artifacts/provenance/run.jsonl": {
          "byte_size": 0,
          "kind": "blob",
          "mode": "100644",
          "oid": "e69de29bb2d1d6434b8b29ae775ad8c2e48c5391",
          "sha256": "e3b0c44298fc1c149afbf4c8996fb92427ae41e4649b934ca495991b7852b855"
        },
        "codex_4af2_uncommitted_20260727.patch": {
          "kind": "absent"
        },
        "docs/semantic_quarantine/PORTABILITY_RELOCATION_SUCCESSOR_RECEIPT_v1.json": {
          "byte_size": 565,
          "kind": "blob",
          "mode": "100644",
          "oid": "4e7496d773b40a24c7d099e4292874ddc183b9f4",
          "sha256": "aa6dee50b405ddeb21b4cfea81c62e1a7e4c1ac7f920e87211e1ce5dbfa6282c"
        },
        "docs/semantic_quarantine/PORTABILITY_RELOCATION_SUCCESSOR_SCHEMA_v1.json": {
          "byte_size": 694,
          "kind": "blob",
          "mode": "100644",
          "oid": "c53d2ef3b4c202de59d690701f9fcade07ad6e8e",
          "sha256": "37d78d0212b28e959583fabdcb9cb5adb6d63404fb36dfe355af07008d7f9018"
        },
        "docs/semantic_quarantine/PORTABILITY_RELOCATION_SUCCESSOR_v1.json": {
          "byte_size": 1443,
          "kind": "blob",
          "mode": "100644",
          "oid": "8df7839d92cffce3bc850baa1e3a52dde03fd062",
          "sha256": "617b3649f97c662aabddbcc8af17b8b55242a6b242669ab6d32b4fa5431a3114"
        },
        "docs/semantic_quarantine/ROOT_ARCHIVE_EXECUTION_UMBRELLA_v1.json": {
          "byte_size": 640,
          "kind": "blob",
          "mode": "100644",
          "oid": "5be9436bff152b4488e7b5df732d43cb50e8f3fb",
          "sha256": "1160da2aa2f5297926edfaf6501aca1f5301c35b778de9f2d83a8d0c29ed57e8"
        },
        "docs/semantic_quarantine/ROOT_ARCHIVE_ZERO_REFERENCE_RECEIPT_v1.json": {
          "byte_size": 58243,
          "kind": "blob",
          "mode": "100644",
          "oid": "f252ff24be54374bcedf0dbd33585fac8af3667e",
          "sha256": "99c8d54feae0f019a182b8aa5439370f198c452c0ee68e993d597d55d482b03e"
        },
        "docs/semantic_quarantine/ROOT_ARCHIVE_ZERO_REFERENCE_SCHEMA_v1.json": {
          "byte_size": 1518,
          "kind": "blob",